<?xml version="1.0" encoding="UTF-8"?>
<xs:schema xmlns:xs="http://www.w3.org/2001/XMLSchema"
           elementFormDefault="qualified">
  <xs:element name="container">
    <xs:complexType>
      <xs:sequence>
        <xs:element name="info">
          <xs:complexType>
            <xs:sequence>
              <xs:element name="product" type="xs:string"/>
              <xs:element name="price" type="xs:string"/>
              <xs:element name="opisanie" type="xs:string"/>
            </xs:sequence>
          </xs:complexType>
        </xs:element>
        <xs:element name="tovar" minOccurs="1" maxOccurs="unbounded">
          <xs:complexType>
            <xs:sequence>
              <xs:element name="name" type="xs:string"/>
              <xs:element name="value" type="xs:decimal"/>
              <xs:element name="description" type="xs:string"/>
            </xs:sequence>
          </xs:complexType>
        </xs:element>
      </xs:sequence>
    </xs:complexType>
  </xs:element>
</xs:schema>







